{   "$schema": "https://json-schema.org/draft/2020-12/schema",   "$id": "urn:elis:schemas:appendix_b",   "title": "ELIS Appendix B â€“ Screening rows (MVP)",   "type": "array",   "items": {     "type": "object",     "additionalProperties": false,     "required": [       "id",       "source_id",       "title",       "decision",       "reason",       "decided_at"     ],     "properties": {       "id": { "type": "string", "minLength": 1 },       "source_id": { "type": "string", "minLength": 1 },       "title": { "type": "string", "minLength": 1 },       "decision": { "type": "string", "enum": ["included", "excluded"] },       "reason": { "type": "string", "minLength": 1 },       "decided_at": { "type": "string", "format": "date-time" }     }   } }